"Subject Code","Catalog Number","Description"
"CRWT","10200","General Transfer Credit-FAR"
"CRWT","10203","Workshop in which students present their writing (fiction, poetry, drama, creative nonfiction) for class analysis; will be complemented by lectures on the genres and readings that exemplify outstanding technique."
"CRWT","20103","Introduces concepts of close reading and the creative writing workshop.  Engages questions of the role of reading in culture, its impact on understanding complex issues, and the connection of reading to composing."
"CRWT","20123","Introduces concepts of close reading and the creative writing workshop.  Engages the craft of travel writing within and across cultures as a way to deepen awareness of what it means to be a global citizen, while fostering a more nuanced view of the individual in the world."
"CRWT","20133","In this creative writing course, students will read and analyze plays, experimental collaborative performances, and poetry, specifically focusing on identity expression through the written word and performance.  Students will also get experience writing their own plays and poetry, as well as receive constructive critiques on their own written work."
"CRWT","30233","Prerequisites: ENGL/WRIT/CRWT 10203 or ENGL/WRIT/CRWT 20103 or ENGL/WRIT/CRWT 20133.  A creative nonfiction writing class for students with some experience in creative writing.  In this course, students will get experience writing memoir, personal essays, autobiography, oral history, and in other nonfiction genres."
"CRWT","30343","Prerequisites: ENGL/WRIT/CRWT 10203 or ENGL/WRIT/CRWT 20103 or ENGL/WRIT/CRWT 20133.  A fiction writing class for students with some experience in creative writing.  Student cannot receive credit for CRWT 55153 and CRWT 30343."
"CRWT","30353","Prerequisites:  ENGL/WRIT/CRWT 10203 or ENGL/WRIT/CRWT 20103 or ENGL/WRIT/CRWT 20133.  A poetry writing class for students with some experience in creative writing.  Student cannot receive credit for CRWT 55273 and CRWT 30353."
"CRWT","30363","Prerequisites: ENGL/WRIT/CRWT 10203 or ENGL/WRIT/CRWT 20103 or ENGL/WRIT/CRWT 20133 or Digital Culture and Data Analytics major or minor.  Explores the composition of creative work using digital technologies - collage, graphic narratives, multimedia poetry/fiction, and creative short animations.  The course emphasizes concepts in creative writing, multimedia, and authorship in digital environments.  Students design and compose a variety of multimedia products incorporating typography, images, and other modes.  Students cannot receive credit for CRWT 55363 and CRWT 30363."
"CRWT","30373","Prerequisites: ENGL/WRIT/CRWT 10203 or ENGL/WRIT/CRWT 20103 or ENGL/WRIT/CRWT 20133.  A dramatic writing workshop, focusing on the growth of students' own work in playwriting and/or screenwriting.  Student cannot receive credit for CRWT 55213 and CRWT 30373."
"CRWT","40133","Prerequisites: ENGL/WRIT/CRWT 10203, ENGL/WRIT/CRWT 20103 or ENGL/WRIT/CRWT 20133 .  A creative nonfiction writing class for students with some experience in creative writing, this a craft/workshop course intended for advanced writers who have a committed interest in creative non-fiction (such as personal essay, literary journalism, travel writing, science writing, memoir, and other non-fiction genres) and are comfortable writing longer works of prose.  As a workshop, students will work cooperatively to share and improve each others' work during the semester.  Student cannot receive credit for CRWT 55133 and ENGL/WRIT/CRWT 40133."
"CRWT","40203","Prerequisites: ENGL/WRIT/CRWT 10203, ENGL/WRIT/CRWT 20103 or ENGL/WRIT/CRWT 20133.  An advanced fiction-writing workshop, focusing on the growth of students' own work.  Prior to enrollment, students are also strongly encouraged to take ENGL/WRIT/CRWT 30343 (Fiction Writing Workshop I)."
"CRWT","40213","Prerequisites: ENGL/WRIT/CRWT 10203, ENGL/WRIT/CRWT 20103 or ENGL/WRIT/CRWT 20133.  An advanced poetry-writing workshop, focusing on the growth of students' own work.  Prior to enrollment, students are also strongly encouraged to take ENGL/WRIT/CRWT 30353 (Poetry Writing Workshop I)."
"CRWT","40223","Prerequisites: ENGL/WRIT/CRWT 10203, ENGL/WRIT/CRWT 20103 or ENGL/WRIT/CRWT 20133.  An advanced dramatic writing workshop, focusing on the growth of students' own work in playwriting and/or screenwriting.  Prior to enrollment, students are strongly encouraged to take another 30000-level course in creative writing.  Student cannot receive credit for CRWT 55223 and CRWT 40223."
"CRWT","40703","Prerequisites:  CRWT 10203, or CRWT 20103, or CRWT 20133, plus the prior completion of a 30000-or 40000-level Creative Writing Workshop with a grade of at least B-.  The Advanced Multi-Genre Workshop is a craft/workshop course in writing poems, fiction, and creative non-fiction.  This class is intended for students who are dedicated to creative writing, who have a strong background in creative writing and sustained experience workshopping.  This class is repeatable for credit.  Student cannot receive credit for CRWT 55703 and CRWT 40703."
"CRWT","40803","Prerequisites: CRWT 10203 or 20103 or 20133, and at least one 30000- or 40000-level Creative Writing Workshop.  An advanced examination of texts representing a specified formal tradition within a literary genre.  Readings will focus on craft techniques and reader expectations in the given formal tradition, familiarizing participants with varied examples within its canon.  Students will construct and critique their own original writing representative of the formal tradition under study.  Focus of literary genre may vary with each offering (i.e., novella, epic poem, one-act plays, et cetera)."
"CRWT","55103","Prerequisites:  CRWT 10203 or CRWT 20103.  A creative nonfiction writing class for students with some experience in creative writing.  In this course, students will get experience writing memoir, personal essays, autobiography, oral history, and in other nonfiction genres.  The course may also include reading of major nonfiction writers from the Renaissance to the present.  Student cannot receive credit for CRWT 55103 and CRWT/ENGL/WRIT 30233."
"CRWT","55133","Prerequisites: ENGL/WRIT/CRWT 10203, ENGL/WRIT/CRWT 20103 or ENGL/WRIT/CRWT 20133 .  A creative nonfiction writing class for students with some experience in creative writing, this a craft/workshop course intended for advanced writers who have a committed interest in creative non-fiction (such as personal essay, literary journalism, travel writing, science writing, memoir, and other non-fiction genres) and are comfortable writing longer works of prose.  As a workshop, students will work cooperatively to share and improve each others' work during the semester.  Student cannot receive credit for CRWT 55133 and ENGL/WRIT/CRWT 40133."
"CRWT","55143","Prerequisites: CRWT 10203, CRWT 20103, or CRWT 20133.  Prior to enrollment, students are also strongly encouraged to take an upper-division creative writing course. Studies in Creative Writing is an intensive creative writing workshop open to students (graduate and advanced undergraduates) who have a strong background in literature and imaginative writing.  Depending on the semester and the selected genre, this course will pay special attention to invention, point-of-view, voice, form, and genre-appropriate theory.  Student cannot receive credit for CRWT 55143 and ENGL 50233."
"CRWT","55153","Prerequisites: ENGL/WRIT/CRWT 10203 or ENGL/WRIT/CRWT 20103 or ENGL/WRIT/CRWT 20133.  A fiction writing class for students with some experience in creative writing.  Student cannot receive credit for CRWT 55153 and CRWT 30343."
"CRWT","55163","Prerequisites:  ENGL/WRIT/CRWT 10203 or ENGL/WRIT/CRWT 20103.  An advanced fiction-writing workshop, focusing on the growth of students' own work.  Prior to enrollment, students are also strongly encouraged to take ENGL/WRIT  30343 (Fiction Writing Workshop I).  Student cannot receive credit for CRWT 55163 and ENGL/WRIT/CRWT 40203."
"CRWT","55173","Prerequisites:  ENGL/WRIT/CRWT 10203 or ENGL/WRIT/CRWT 20103.  An advanced poetry-writing workshop, focusing on the growth of students' own work.  Prior to enrollment, students are also strongly encouraged to take ENGL/WRIT/CRWT 30353 (Poetry Writing Workshop I).  Student cannot receive credit for CRWT 55173 and ENGL/WRIT/CRWT 40213."
"CRWT","55213","Prerequisites:  ENGLWRIT/CRWT 10203, ENGL/WRIT/CRWT 20103 or ENGL/WRIT/CRWT 20133.  A dramatic writing workshop, focusing on the growth of students' own work in playwriting and/or screenwriting.  Student cannot receive credit for CRWT 55213 and CRWT 30373."
"CRWT","55213","Prerequisites: ENGL/WRIT/CRWT 10203 or ENGL/WRIT/CRWT 20103 or ENGL/WRIT/CRWT 20133.  A dramatic writing workshop, focusing on the growth of students' own work in playwriting and/or screenwriting.  Student cannot receive credit for CRWT 55213 and CRWT 30373."
"CRWT","55223","Prerequisites: ENGL/WRIT/CRWT 10203, ENGL/WRIT/CRWT 20103 or ENGL/WRIT/CRWT 20133.  An advanced dramatic writing workshop, focusing on the growth of students' own work in playwriting and/or screenwriting.  Prior to enrollment, students are strongly encouraged to take another 30000-level course in creative writing.  Student cannot receive credit for CRWT 55223 and CRWT 40223."
"CRWT","55273","Prerequisites:  ENGL/WRIT/CRWT 10203 or ENGL/WRIT/CRWT 20103 or ENGL/WRIT/CRWT 20133.  A poetry writing class for students with some experience in creative writing.  Student cannot receive credit for CRWT 55273 and CRWT 30353."
"CRWT","55273","Prerequisites:  ENGL/WRIT/CRWT 10203, ENGLWRIT/CRWT 20103 or ENGL/WRIT/CRWT 20133.  A poetry writing class for students with some experience in creative writing.  Student cannot receive credit for CRWT 55273 and CRWT 30353."
"CRWT","55313","Prerequisites:  CRWT 10203 or 20103.  An advanced dramatic writing workshop, focusing on the growth of students' own work in playwriting and/or screenwriting.  Prior to enrollment, students are strongly encouraged to take another 30000-level course in creative writing.  Student cannot receive credit for CRWT 55313 and CRWT 40223."
"CRWT","55363","Prerequisites: ENGL/WRIT/CRWT 10203 or ENGL/WRIT/CRWT 20103 or ENGL/WRIT/CRWT 20133 or Digital Culture and Data Analytics major or minor.  Explores the composition of creative work using digital technologies - collage, graphic narratives, multimedia poetry/fiction, and creative short animations.  The course emphasizes concepts in creative writing, multimedia, and authorship in digital environments.  Students design and compose a variety of multimedia products incorporating typography, images, and other modes.  Students cannot receive credit for CRWT 55363 and CRWT 30363."
"CRWT","55703","Prerequisites:  CRWT 10203, or CRWT 20103, or CRWT 20133, plus the prior completion of a 30000-or 40000-level Creative Writing Workshop with a grade of at least B-.  The Advanced Multi-Genre Workshop is a craft/workshop course in writing poems, fiction, and creative non-fiction.  This class is intended for students who are dedicated to creative writing, who have a strong background in creative writing and sustained experience workshopping.  This class is repeatable for credit.  Student cannot receive credit for CRWT 55703 and CRWT 40703."
"CRWT","55973","Prerequisites:  ENGL 10803, ENGL 20803, and at least one 10000-or 20000-level ENGL/WRIT/CRWT course.  Directed Study in Creative Writing."
"CRWT","55973","Prerequisites:  ENGL 10803, 20803, and at least one 10000- or 20000-level ENGL/WRIT/CRWT course.  Directed Study in Creative Writing."
"ENGL","10103","Reading and analysis of prose fiction by a variety of authors.  The course may focus on a specific historical period or may cover a more extensive time span.  Students will become familiar with interpretive strategies and will examine the course texts in relation to literary antecedents, the conventions of various genres, and the cultural circumstances of composition."
"ENGL","10113","Reading and analysis of a wide variety of American and British poetry.  The goal of the course will be to help students understand that poetry is not difficult and dull, but understandable, worthwhile, and enjoyable."
"ENGL","10123","Reading and analysis of the various dramatic genres."
"ENGL","10133","Reading and analysis of a variety of genres by a variety of authors.  The course may focus on a specific historical period or may cover a more extensive time span.  Students will become familiar with interpretive strategies and will examine the course texts in relation to literary antecedents, literary analysis as a research method, and the cultural circumstances of composition.  Subtopics will often vary by section.  This course cannot be repeated for additional credit."
"ENGL","10200","General Transfer Credit"
"ENGL","10303","A study of aesthetic and ideological differences between literary source texts and the films, scripts, television series, video games, and other media adapted from and inspired by them."
"ENGL","10503","This course provides an introductory-level study of a variety of genres that do not fit the mold of fiction, poetry or drama.  Readings will vary by semester, and may include such genres as oratory, essay, memoir, autobiography, oral history, diary, speeches, letters, belles lettres, chronicles, periodicals, treatises, manifestos, travelogues, weblogs, podcasts, dialogues, debates, didactic and religious writings and/or documentary film and television."
"ENGL","10703","Introduction to critical writing, reading, and research in the university.  ENGL 10703, when followed by a designated section of ENGL 10803, gives students the opportunity to engage in a year-long study of academic writing.  Includes attention to invention, drafting, revision, and editing of various genres of academic writing.  Designed for students who do not have extensive experience writing research-based academic essays.  Not available to student who have credit for ENGL 10803."
"ENGL","10803","Course satisfies Written Communication 1 (WCO) requirement in the TCU Core Curriculum.  Writing workshop where students compose multiple pieces in a range of genres using appropriate rhetorical conventions, learn strategies for reading texts and visual critically, and incorporate suitable sources.  Students will engage in processes for invention, drafting, critiquing, revising, and editing of prose.  Note: themed sections on a range of topics may be offered and will be designated with a descriptive course title."
"ENGL","10803","Course satisfies Written Communication 1 (WCO) requirement in the TCU Core Curriculum.  Writing workshop where students compose multiple pieces in a range of genres using appropriate rhetorical conventions, learn strategies for reading texts and visual critically, and incorporate suitable sources.  Students will engage in processes for invention, drafting, critiquing, revising, and editing of prose.  Note: themed sections on a range of topics may be offered and will be designated with a descriptive course title."
"ENGL","20000","English Literature Transfer work with TCUCC-HUM, LT credit."
"ENGL","20001","Transfer work."
"ENGL","20203","Girls' Studies examines the experiences and representation of girls in the U.S. and global cultures through various feminist theoretical lenses and considers girlhood as a gender category worthy of academic analysis.  Using academic and popular texts - including those produced in literature, online, and via television, film, and music - this course studies the category of girlhood in relation to dominant cultural practices and larger social, institutional, and political transformations."
"ENGL","20213","This course examines literature by women outside the United States and Europe, using a variety of recent theories about gender, nationalism, and historiography.  Students will consider the fundamental place of gender in shaping a cultural narrative, and we will concentrate on the ways in which gender and sexuality are configured in the literature of women in various national, cultural, social, and political contexts.  Themes considered may include sexuality, memory, race, decolonization, migration, nationalism, history, and diaspora."
"ENGL","20223","This course will explore how gender is portrayed in cultural texts across a range of genres and introduce students to theories of representation.  Students will examine how gender difference is represented in literature, art or film; the cultural implications of those representations; and how texts may perpetuate, challenge, and/or subvert gendered stereotypes.  Texts might include novels, short stories, plays, film, television shows, web texts and social media, visual art, graphic novels, and essays."
"ENGL","20233","An introductory course on interpreting gender, sex and sexuality in literature using a variety of methodologies.  Readings will vary by semester, but will always represent a spectrum of human sexual experience from diverse cultures, and draw on a variety of genres, such as poetry, drama, fiction, biography, film and essay."
"ENGL","20403","Studies of texts by British writers from the beginnings of English literature to the present. Texts vary by semester."
"ENGL","20423","An introduction to many different genres of medieval literature including poetry, prose, epic, saga, romance, myth, frame tale, and drama from various medieval cultures around the world.  Students will become familiar with interpretive strategies and will examine the course texts in relation to the cultural and historical circumstances of composition."
"ENGL","20433","Introduction to and analysis of 6-7 plays, with reference to the sociocultural context in which the plays were composed and the ways they (and their author) have been interpreted and appropriated since the late sixteenth century. This course is designed for undergraduates with little or no preparation in literary studies."
"ENGL","20500","Transfer work with UCR/TCUCC credit."
"ENGL","20503","Studies of texts by American writers from the beginnings of American literature to the present. Texts vary by semester."
"ENGL","20523","Prerequisites: ENGL 10803, ENGL 20803.  ENGL 20803 may be taken concurrently with ENGL 20523.  An examination of the question of how and why American authors employ sports-centered materials in their work."
"ENGL","20533","The American success dream as depicted and evaluated by major writers from Colonial times to the present."
"ENGL","20543","A survey of the American short story from its origins to the present."
"ENGL","20553","An introduction to the interdisciplinary field of American studies, which brings together work from across the humanities and social sciences to study the histories, ideas, and collectively told stories that constitute the nation and shape its culture.  Engages key concepts in the field, including the construction of difference and identity, racism and antiracism, war and empire, cultural memory, and globalization."
"ENGL","20563","An introduction to writings of diverse genres and historical periods by Hispanic and/or Latina/o writers from what is now the U.S.A. Latina/o literature will serve as the primary readings for students to engage and examine key concepts of literary criticism and cultural history."
"ENGL","20573","An introduction to the diverse literatures of Native America.  The course may focus on a specific historical period or may cover a more extensive time span."
"ENGL","20583","The American West and the Western hero in fiction, from James Fenimore Cooper to selected contemporary authors."
"ENGL","20593","This course will introduce literary and cultural production (prose, poetry, nonfiction, drama and film) of the global African Diaspora with attention to themes of identity, language, exile, and legacies of colonialism and imperialism.  Students will examine this literature from aesthetic, historical, and social contexts."
"ENGL","20603","Two period surveys, the first from ancient Greece to the Renaissance, and the second from the Enlightenment to the present. The primary emphasis will be historical, but individual instructors may vary the choice and treatment of texts to explore important developments of theme (e.g., the hero, journey, and monsters) or genre (e.g., tragedy, epic, romance, and lyric). Students may take both courses or either course."
"ENGL","20613","Two period surveys, the first from ancient Greece to the Renaissance, and the second from the Enlightenment to the present. The primary emphasis will be historical, but individual instructors may vary the choice and treatment of texts to explore important developments of theme (e.g., the hero, journey, monsters) or genre (e.g., tragedy, epic, romance, lyric). Students may take both courses or either course."
"ENGL","20623","This course examines women writers who create forms of expression as well as contribute to literature and/or rhetoric.  The course may focus on a specific historical period or may cover a more extensive time span."
"ENGL","20633","Study of major Greek and Roman myths, gods, and heroes, as these reflect cultural values and problems, and including some study of major literary forms."
"ENGL","20643","An examination of a wide range of texts, some that are classified as fable or fantasy literature as well as some that incorporate elements from these genres. The course may focus on a specific historical period or may cover a more extensive time span."
"ENGL","20653","A study of the means by which the spirit of romanticism is embodied in literature since the late 18th century."
"ENGL","20663","Why do people read literature, and in what ways might it matter?  This course explores the personal, civic, and cultural significance of reading literature through assigned readings and a service learning component.  Students will thus explore literary works and theories about literature's significance in multiple contexts: in individual reading and reflection, in group discussions in the classroom, and in dialogue with community residents in the civic context of Fort Worth."
"ENGL","20683","Examines individual texts, authors, and recurring themes in Young Adult literature.  Students will analyze the genre's place in American culture by surveying its history, exploring the influence of major writers' diverse ethnic, class, and gendered backgrounds, and examining its interactions with other popular forms such as graphic and film texts.  Students will also examine the interactive relationship between YA texts and social issues, particularly those related to diversity, equity, and inclusion."
"ENGL","20703","Course examines interactions between literature and the law, with attention to the way in which literary texts enter debates over morality, justice, and the strengths and weaknesses of legal systems.  Texts from a variety of periods and national origins."
"ENGL","20713","This course examines literary works in a variety of genres that treat topics related to health care and medicine.  Students will consider ways in which narrative shapes cultural understandings of health, sickness, and the body as well as ways in which literary writers have used health and sickness as metaphors to explore the human condition.  Themes may include caregiving, doctor/patient relationships, chronic illness, reproduction, mental illness, infection and contagion, and disability."
"ENGL","20723","This course introduces students to disability studies, a discipline at the intersection of humanities and social sciences that focuses on the lived experiences of disabled people and on the societal structures and systems of privilege and oppression that construct those experiences.  Students will read theory, social science, and literary texts on cultural conceptions of disability, and assignments will ask students to analyze representations of disability and disability access in assigned texts and in their communities."
"ENGL","20733","Historical development of science fiction as a literary genre with particular attention given to significant authors and themes."
"ENGL","20743","Crime, detective and suspense fiction in its social and historical context, illustrated by selected major works and authors."
"ENGL","20753","Studies of the aesthetic, ideological, and historical dimensions of film genre(s) such as film noir, horror, romantic comedy, the musical, etc, with examples drawn from global film industries.  Topics will vary by semester and may include a comparative approach to genre."
"ENGL","20803","Course satisfies Written Communication 2 (WCO) requirement in the TCU Core Curriculum.  Prerequisite: ENGL 10803 or equivalent and sophomore standing (24 hours).  Writing workshop that builds on ENGL 10803 by focusing on the analysis and production of arguments in a variety of media (i.e., print, visual, oral, digital).  Students will work individually and collaboratively to read, research, and compose effective arguments on issues of local and national importance.  Note: themed sections on a range of topics may be offered and will be designated with a descriptive course title."
"ENGL","20813","This class provides an overview of the different types of digital methodologies available to the humanities student and scholar and introduces students to how humanities questions may be addressed using digital methods.  Though there are many ways to approach the digital humanities, this class will focus on three specific areas of digital scholarship:  archives and editions, text analysis, and digital map making.  No previous experience in technology or programming is required."
